{
  "schemaVersion": 2,
  "id": "01KYN3EZ67HREQQXJ4NBE54608",
  "occurredAt": "2026-07-28T19:33:10.983644Z",
  "expectedRevision": 5,
  "revision": 6,
  "kind": "phase_started",
  "actor": "codex-tester",
  "summary": "Claimed verify for external check-in",
  "previousEvent": "01KYN35R1QM6VARWARZ9DV36MF",
  "state": {
    "protocol": "empirical-sdd",
    "schemaVersion": 2,
    "revision": 6,
    "projectId": "PRJ-01KYN334D58TF65Q9CTVZA739D",
    "currentSpec": "001-portable-resumable-sdd-library",
    "profile": "strong",
    "mode": "autonomous",
    "phase": "verify",
    "status": "running",
    "repairAttempts": 1,
    "specRevision": 1,
    "specHash": "sha256:4f5a2ec77d8da9caf77fd7c17a32d9836216e89f55c12b50ce3e58c1e2dee6b4",
    "lastEvent": "01KYN3EZ67HREQQXJ4NBE54608",
    "implementationActor": "codex-implementation",
    "message": null
  }
}