{
  "schemaVersion": 2,
  "id": "01KYN3EZA94GEWAJ4G72SP5EVP",
  "occurredAt": "2026-07-28T19:33:11.113122Z",
  "expectedRevision": 6,
  "revision": 7,
  "kind": "phase_passed",
  "actor": "codex-tester",
  "summary": "All 46 unit, CLI, and conformance tests passed; formatting, strict lint, MSRV, package, schema, installer, repository lifecycle, and global command-pack smoke checks also passed.",
  "previousEvent": "01KYN3EZ67HREQQXJ4NBE54608",
  "state": {
    "protocol": "empirical-sdd",
    "schemaVersion": 2,
    "revision": 7,
    "projectId": "PRJ-01KYN334D58TF65Q9CTVZA739D",
    "currentSpec": "001-portable-resumable-sdd-library",
    "profile": "strong",
    "mode": "autonomous",
    "phase": "review",
    "status": "waiting",
    "repairAttempts": 0,
    "specRevision": 1,
    "specHash": "sha256:4f5a2ec77d8da9caf77fd7c17a32d9836216e89f55c12b50ce3e58c1e2dee6b4",
    "lastEvent": "01KYN3EZA94GEWAJ4G72SP5EVP",
    "implementationActor": "codex-implementation",
    "message": null
  }
}