{
  "schemaVersion": 2,
  "id": "01KYN6TWBV6650Y7EZBBR196Z6",
  "occurredAt": "2026-07-28T20:32:07.03587Z",
  "expectedRevision": 18,
  "revision": 19,
  "kind": "completed",
  "actor": "codex-independent-reviewer",
  "summary": "Independent final review approved the release with no remaining correctness, security, portability, or v1 compatibility blockers.",
  "previousEvent": "01KYN6TW45AAAMYBHH4MJHRB6C",
  "state": {
    "protocol": "empirical-sdd",
    "schemaVersion": 2,
    "revision": 19,
    "projectId": "PRJ-01KYN334D58TF65Q9CTVZA739D",
    "currentSpec": "001-portable-resumable-sdd-library",
    "profile": "strong",
    "mode": "autonomous",
    "phase": "done",
    "status": "done",
    "repairAttempts": 0,
    "specRevision": 1,
    "specHash": "sha256:4f5a2ec77d8da9caf77fd7c17a32d9836216e89f55c12b50ce3e58c1e2dee6b4",
    "lastEvent": "01KYN6TWBV6650Y7EZBBR196Z6",
    "implementationActor": "codex-evidence-repair",
    "message": null
  }
}