{
  "schemaVersion": 2,
  "id": "01KYN334D6T0B0D3VZCDVBGRT0",
  "occurredAt": "2026-07-28T19:26:43.110831Z",
  "expectedRevision": 0,
  "revision": 1,
  "kind": "adopted",
  "actor": "empirical-self-adopt",
  "summary": "Adopted repository without renaming v1 artifacts",
  "previousEvent": null,
  "state": {
    "protocol": "empirical-sdd",
    "schemaVersion": 2,
    "revision": 1,
    "projectId": "PRJ-01KYN334D58TF65Q9CTVZA739D",
    "currentSpec": "001-portable-resumable-sdd-library",
    "profile": "strong",
    "mode": "autonomous",
    "phase": "implement",
    "status": "waiting",
    "repairAttempts": 0,
    "specRevision": 1,
    "specHash": "sha256:4f5a2ec77d8da9caf77fd7c17a32d9836216e89f55c12b50ce3e58c1e2dee6b4",
    "lastEvent": "01KYN334D6T0B0D3VZCDVBGRT0",
    "implementationActor": null,
    "message": "Repository adopted into Empirical SDD v2"
  }
}