{
  "schemaVersion": 2,
  "id": "01KYN4VEYMFGVRXYV86222YTRP",
  "occurredAt": "2026-07-28T19:57:28.916674Z",
  "expectedRevision": 9,
  "revision": 10,
  "kind": "phase_started",
  "actor": "codex-implementation-repair",
  "summary": "Claimed implement for external check-in",
  "previousEvent": "01KYN4TT5577349D1KKQAQNBMB",
  "state": {
    "protocol": "empirical-sdd",
    "schemaVersion": 2,
    "revision": 10,
    "projectId": "PRJ-01KYN334D58TF65Q9CTVZA739D",
    "currentSpec": "001-portable-resumable-sdd-library",
    "profile": "strong",
    "mode": "autonomous",
    "phase": "implement",
    "status": "running",
    "repairAttempts": 1,
    "specRevision": 1,
    "specHash": "sha256:4f5a2ec77d8da9caf77fd7c17a32d9836216e89f55c12b50ce3e58c1e2dee6b4",
    "lastEvent": "01KYN4VEYMFGVRXYV86222YTRP",
    "implementationActor": "codex-implementation",
    "message": null
  }
}