{
  "schemaVersion": 2,
  "id": "01KYN6J1F9HWBX87QAA9S2HZ1F",
  "occurredAt": "2026-07-28T20:27:17.35361Z",
  "expectedRevision": 14,
  "revision": 15,
  "kind": "phase_passed",
  "actor": "codex-evidence-repair",
  "summary": "Fixed stale-evidence history so fresh workspace-bound proof can supersede retained older records, with a regression test covering invalidation and recovery.",
  "previousEvent": "01KYN6J1B9VR3DZWQQNEHH9J4Y",
  "state": {
    "protocol": "empirical-sdd",
    "schemaVersion": 2,
    "revision": 15,
    "projectId": "PRJ-01KYN334D58TF65Q9CTVZA739D",
    "currentSpec": "001-portable-resumable-sdd-library",
    "profile": "strong",
    "mode": "autonomous",
    "phase": "verify",
    "status": "waiting",
    "repairAttempts": 0,
    "specRevision": 1,
    "specHash": "sha256:4f5a2ec77d8da9caf77fd7c17a32d9836216e89f55c12b50ce3e58c1e2dee6b4",
    "lastEvent": "01KYN6J1F9HWBX87QAA9S2HZ1F",
    "implementationActor": "codex-evidence-repair",
    "message": null
  }
}