{
  "schemaVersion": 2,
  "id": "01KYN6S6ST8A8C3T81MQ77F8TQ",
  "occurredAt": "2026-07-28T20:31:12.186723Z",
  "expectedRevision": 16,
  "revision": 17,
  "kind": "phase_passed",
  "actor": "codex-final-tester",
  "summary": "Final release verification passed after the evidence-history repair: 55 tests, Clippy, Rust 1.85, package verification, live v1 adoption, and all-host command-pack checks succeeded.",
  "previousEvent": "01KYN6S698Q7DM5ZN88KFWGBH1",
  "state": {
    "protocol": "empirical-sdd",
    "schemaVersion": 2,
    "revision": 17,
    "projectId": "PRJ-01KYN334D58TF65Q9CTVZA739D",
    "currentSpec": "001-portable-resumable-sdd-library",
    "profile": "strong",
    "mode": "autonomous",
    "phase": "review",
    "status": "waiting",
    "repairAttempts": 0,
    "specRevision": 1,
    "specHash": "sha256:4f5a2ec77d8da9caf77fd7c17a32d9836216e89f55c12b50ce3e58c1e2dee6b4",
    "lastEvent": "01KYN6S6ST8A8C3T81MQ77F8TQ",
    "implementationActor": "codex-evidence-repair",
    "message": null
  }
}