{
  "schemaVersion": 2,
  "id": "01KYN344H3JW1NQDS1AA765387",
  "occurredAt": "2026-07-28T19:27:16.003742Z",
  "expectedRevision": 2,
  "revision": 3,
  "kind": "repair_scheduled",
  "actor": "empirical-self-check",
  "summary": "invalid specification: required artifact is empty or not a regular file: /Users/mateocerquetella/Developer/projects/empirical-sdd/src",
  "previousEvent": "01KYN344DGXBHYY1YJENWSWEJ1",
  "state": {
    "protocol": "empirical-sdd",
    "schemaVersion": 2,
    "revision": 3,
    "projectId": "PRJ-01KYN334D58TF65Q9CTVZA739D",
    "currentSpec": "001-portable-resumable-sdd-library",
    "profile": "strong",
    "mode": "autonomous",
    "phase": "implement",
    "status": "waiting",
    "repairAttempts": 1,
    "specRevision": 1,
    "specHash": "sha256:4f5a2ec77d8da9caf77fd7c17a32d9836216e89f55c12b50ce3e58c1e2dee6b4",
    "lastEvent": "01KYN344H3JW1NQDS1AA765387",
    "implementationActor": null,
    "message": "invalid specification: required artifact is empty or not a regular file: /Users/mateocerquetella/Developer/projects/empirical-sdd/src"
  }
}