{
  "schemaVersion": 2,
  "id": "01KYN6ESJXHPZX2GBP9YHX7PH1",
  "occurredAt": "2026-07-28T20:25:30.973256Z",
  "expectedRevision": 11,
  "revision": 12,
  "kind": "phase_started",
  "actor": "codex-tester",
  "summary": "Claimed verify for external check-in",
  "previousEvent": "01KYN4VF1X989MGKYFBD3P5TEH",
  "state": {
    "protocol": "empirical-sdd",
    "schemaVersion": 2,
    "revision": 12,
    "projectId": "PRJ-01KYN334D58TF65Q9CTVZA739D",
    "currentSpec": "001-portable-resumable-sdd-library",
    "profile": "strong",
    "mode": "autonomous",
    "phase": "verify",
    "status": "running",
    "repairAttempts": 0,
    "specRevision": 1,
    "specHash": "sha256:4f5a2ec77d8da9caf77fd7c17a32d9836216e89f55c12b50ce3e58c1e2dee6b4",
    "lastEvent": "01KYN6ESJXHPZX2GBP9YHX7PH1",
    "implementationActor": "codex-implementation-repair",
    "message": null
  }
}